<?xml version="1.0" encoding="UTF-8"?>
<!DOCTYPE konyv SYSTEM "HD_konyv.dtd">
<konyvek>
	<konyv id="1" >
		<cim>Clean Code</cim>
		<kiadasiev>1999. szeptember</kiadasiev>
		<kiado>valakik 1</kiado>
		<szerzo>valaki 1 1</szerzo>
		<szerzo>valaki 1 2</szerzo>
	</konyv>
	
	<konyv id="2" >
		<cim>Clean Architecture</cim>
		<kiadasiev>1987. szeptember</kiadasiev>
		<kiado>valakik 2</kiado>
		<szerzo>valaki 2</szerzo>
	</konyv>
</konyvek>
